type_of_reference,title,secondary_title,start_page,end_page,authors,year,keywords,doi,journal_name,number,issn,unknown_tag,volume,alternate_title2,publication_year,abstract,database
CONF,AI Assisted Internet Finance Intelligent Risk Control System Based on Reptile Data Mining and Fuzzy Clustering,"2020 Fourth International Conference on I-SMAC (IoT in Social, Mobile, Analytics and Cloud) (I-SMAC)",533,536,['N. Yang'],2020,"['Finance', 'Games', 'Tools', 'Control systems', 'Data models', 'Data mining', 'Artificial intelligence', 'Data Mining', 'Fuzzy Clustering', 'Control System', 'Internet Finance', 'Intelligent Model', 'Artificial Intelligence']",10.1109/I-SMAC49090.2020.9243608,"2020 Fourth International Conference on I-SMAC (IoT in Social, Mobile, Analytics and Cloud) (I-SMAC)",,,"defaultdict(<class 'list'>, {'VO': ['']})",,"2020 Fourth International Conference on I-SMAC (IoT in Social, Mobile, Analytics and Cloud) (I-SMAC)",7-9 Oct. 2020,"AI-assisted Internet finance intelligent risk control system based on the reptile data mining and fuzzy clustering is designed and implemented in the paper. The novelties are proposed as follows. (1) General-purpose web crawlers often use certain crawling strategies to shorten the crawling time, more commonly used are the depth priority, the AI is adopted to optimize the tool. (2) The prevention of network script viruses must first start with the standard use of script files, and resolutely resist script files with unknown sources, the fuzzy data mining model is integrated to achieve efficient algorithm. (3) Internet finance intelligent risk control system is implemented through the software. The experiment has shown the performance.",IEEE
CONF,Using Unconditional Diffusion Models in Level Generation for Super Mario Bros,2023 18th International Conference on Machine Vision and Applications (MVA),1,5,"['H. J. Lee', 'E. Simo-Serra']",2023,"['Video games', 'Machine vision', 'Games']",10.23919/MVA57639.2023.10215856,2023 18th International Conference on Machine Vision and Applications (MVA),,,"defaultdict(<class 'list'>, {'VO': ['']})",,2023 18th International Conference on Machine Vision and Applications (MVA),23-25 July 2023,"This study introduces a novel methodology for generating levels in the iconic video game Super Mario Bros. using a diffusion model based on a UNet architecture. The model is trained on existing levels, represented as a categorical distribution, to accurately capture the game’s fundamental mechanics and design principles. The proposed approach demonstrates notable success in producing high-quality and diverse levels, with a significant proportion being playable by an artificial agent. This research emphasizes the potential of diffusion models as an eﬃcient tool for procedural content generation and highlights their potential impact on the development of new video games and the enhancement of existing games through generated content.",IEEE
CONF,Evaluating the usage of Text to3D scene generation methods in Game-Based Learning,2023 24th International Conference on Control Systems and Computer Science (CSCS),633,640,"['A. Gradinaru', 'M. Vrejoiu', 'F. Moldoveanu', 'M. -A. Balutoiu']",2023,"['Surveys', 'Video games', 'Three-dimensional displays', 'Natural languages', 'Semantics', 'Virtual environments', 'Process control', 'text to 3d scene', 'natural language processing', 'text to scene conversion', 'text to graphics', 'visual representation', 'game-based learning']",10.1109/CSCS59211.2023.00105,2023 24th International Conference on Control Systems and Computer Science (CSCS),,2379-0482,"defaultdict(<class 'list'>, {'VO': ['']})",,2023 24th International Conference on Control Systems and Computer Science (CSCS),24-26 May 2023,"Computer games as an educational tool significantly improved information retention, student involvement, and motivation. Despite the growing popularity and the demonstrated positive impact, little progress is made to let educators create games without learning game programming or investing massive amounts of time, money, and human resources. This paper considers the usage of procedural content generation in simplifying the generation of game environments. Given that most educational material is in text format, we evaluate the possibility of generating 3D scenes starting from natural language text. A comprehensive survey of the current methods is presented, analyzing whether they can be successfully used in game-based learning. The study discusses several current limitations and possible improvements, highlighting a need for better progress in the domain.",IEEE
CONF,"A Collaborative, Immersive Language Learning Environment Using Augmented Panoramic Imagery",2020 6th International Conference of the Immersive Learning Research Network (iLRN),225,229,"['S. Chabot', 'J. Drozdal', 'M. Peveler', 'Y. Zhou', 'H. Su', 'J. Braasch']",2020,"['Vocabulary', 'Games', 'Cultural differences', 'Artificial intelligence', 'Tools', 'Global communication', 'Collaboration', 'immersive learning', 'virtual environment', 'foreign language', 'multimodal']",10.23919/iLRN47897.2020.9155140,2020 6th International Conference of the Immersive Learning Research Network (iLRN),,,"defaultdict(<class 'list'>, {'VO': ['']})",,2020 6th International Conference of the Immersive Learning Research Network (iLRN),21-25 June 2020,"Augmenting immersive technologies with AI for foreign language learning is a relatively unexplored, multidisciplinary, and complex research paradigm. The Cognitive and Immersive Room at Rensselaer Polytechnic Institute facilitates cultural and foreign language learning beyond a traditional classroom setting. Exploration of virtual environments and real-world renderings occur at human-scale by groups of students and teachers simultaneously, without the need for head-mounted displays. Students travel to true-to-life Panoramic Scenes to learn authentic cultural knowledge and practice vocabulary within the same surroundings they would use such knowledge while traveling abroad. Multimodal input allows students to engage with the system through gesture, voice, and spatial positioning, creating a dynamic language learning experience. This work underwent initial assessment in a six-week summer course, AI-Assisted Immersive Chinese, and preliminary qualitative results find a majority of surveyed students indicate the system is useful, engaging, and fun.",IEEE
CONF,Terrain-adaptive PCGML in Minecraft,2024 IEEE Conference on Games (CoG),1,8,"['A. van der Staaij', 'M. Preuss', 'C. Salge']",2024,"['Machine learning algorithms', 'Closed box', 'Machine learning', 'Games', 'PCG', 'PCGML', 'Minecraft', 'GAN']",10.1109/CoG60054.2024.10645652,2024 IEEE Conference on Games (CoG),,2325-4289,"defaultdict(<class 'list'>, {'VO': ['']})",,2024 IEEE Conference on Games (CoG),5-8 Aug. 2024,"We make a first step towards terrain-adaptive PCGML in Minecraft by introducing an automated system to create “volume-to-volume” datasets suitable for machine learning by leveraging handwritten black-box Minecraft settlement generation algorithms. Using this system, we create ten terrain-adaptive Minecraft ML datasets - including ones based on the currently best-performing algorithm submitted to the Generative Design in Minecraft (GDMC) competition. Finally, we train and qualitatively evaluate various GAN-based volume-to-volume models on all ten of our datasets. Although we do not obtain good results in all cases, we demonstrate that terrain-adaptive PCGML in Minecraft is indeed feasible.",IEEE
JOUR,Developing an AI-Assisted Low-Resource Spoken Language Learning App for Children,IEEE Access,86025,86037,"['Y. Getman', 'N. Phan', 'R. Al-Ghezi', 'E. Voskoboinik', 'M. Singh', 'T. Grósz', 'M. Kurimo', 'G. Salvi', 'T. Svendsen', 'S. Strömbergsson', 'A. Smolander', 'S. Ylinen']",2023,"['Hidden Markov models', 'Training', 'Speech recognition', 'Task analysis', 'Recording', 'Vocabulary', 'Toy manufacturing industry', 'Pediatrics', 'Computer aided diagnosis', 'Artificial intelligence', 'ASR', 'children’s speech', 'L2 speech', 'speech rating', 'SSD', 'wav2vec2']",10.1109/ACCESS.2023.3304274,IEEE Access,,2169-3536,"defaultdict(<class 'list'>, {'VO': ['11']})",11,IEEE Access,2023,"Computer-assisted Language Learning (CALL) is a rapidly developing area accelerated by advancements in the field of AI. A well-designed and reliable CALL system allows students to practice language skills, like pronunciation, any time outside of the classroom. Furthermore, gamification via mobile applications has shown encouraging results on learning outcomes and motivates young users to practice more and perceive language learning as a positive experience. In this work, we adapt the latest speech recognition technology to be a part of an online pronunciation training system for small children. As part of our gamified mobile application, our models will assess the pronunciation quality of young Swedish children diagnosed with Speech Sound Disorder, and participating in speech therapy. Additionally, the models provide feedback to young non-native children learning to pronounce Swedish and Finnish words. Our experiments revealed that these new models fit into an online game as they function as speech recognizers and pronunciation evaluators simultaneously. To make our systems more trustworthy and explainable, we investigated whether the combination of modern input attribution algorithms and time-aligned transcripts can explain the decisions made by the models, give us insights into how the models work and provide a tool to develop more reliable solutions.",IEEE
JOUR,"Assessing GitHub Copilot in Solidity Development: Capabilities, Testing, and Bug Fixing",IEEE Access,164389,164411,"['G. Baralla', 'G. Ibba', 'R. Tonelli']",2024,"['Codes', 'Software development management', 'Smart contracts', 'Programming', 'Artificial intelligence', 'Security', 'Python', 'Encoding', 'Computer languages', 'Complexity theory', 'GitHub copilot', 'solidity', 'smart contract', 'AI', 'bug fixing', 'vulnerability']",10.1109/ACCESS.2024.3486365,IEEE Access,,2169-3536,"defaultdict(<class 'list'>, {'VO': ['12']})",12,IEEE Access,2024,"In the rapidly evolving landscape of blockchain technology, the development of reliable and secure smart contracts represents one of several crucial challenges. GitHub Copilot, an AI-powered code assistant, aims to enhance developer productivity by generating code snippets, facilitating testing, and assisting in program repair. This research examines Copilot’s proficiency in generating functional and secure smart contracts, including token creation adhering to standards such as ERC20, ERC721, and ERC1155 with various optional features. Additionally, the study assesses its effectiveness in common development tasks, including the implementation of widely employed libraries such as SafeMath. Through controlled experiments, the accuracy, efficiency, and security of the code generated by Copilot are evaluated. This evaluation identifies both its strengths in expediting the development process and its limitations in managing complex blockchain-specific logic and security considerations. The findings contribute to an expanded understanding of the role of AI-assisted programming in blockchain development, offering insights into how developers can best leverage such tools in creating and testing smart contracts. This research aims to guide both practitioners and researchers in the blockchain domain, advancing the discussion on integrating AI into software development workflows in the context of Solidity and smart contract development, underscoring the need for further research to address the challenges and opportunities presented by AI in blockchain technology.",IEEE
