type_of_reference,title,secondary_title,start_page,end_page,authors,year,keywords,doi,journal_name,number,issn,unknown_tag,volume,alternate_title2,publication_year,abstract,database
CONF,Generating Object Placements for Optimum Exploration and Unpredictability in Medium-Coupling Educational Games,"2020 International Conference on Innovation and Intelligence for Informatics, Computing and Technologies (3ICT)",1,6,"['P. W. Atmaja', 'Sugiarto']",2020,"['Games', 'Couplings', 'Standards', 'Chemical elements', 'Informatics', 'Statistics', 'Sociology', 'procedural content generation', 'educational games', 'medium coupling', 'object placements', 'evolutionary algorithm.']",10.1109/3ICT51146.2020.9311976,"2020 International Conference on Innovation and Intelligence for Informatics, Computing and Technologies (3ICT)",,,"defaultdict(<class 'list'>, {'VO': ['']})",,"2020 International Conference on Innovation and Intelligence for Informatics, Computing and Technologies (3ICT)",20-21 Dec. 2020,"Educational games are powerful tools in the era of Education 4.0. However, their applications are hampered by many issues, including high development costs. Procedural content generation (PCG) and medium coupling are two potent methods for reducing an educational game's development cost; however, their joint application is under-studied. In this study, we explored the topic through a PCG application for generating placements of objects representing elements of learning content in a game map. The content consisted of correct answers, which the player must gather in the correct order, and wrong answers, which the player must avoid. We employed an evolutionary algorithm in three stages of the generation: it first generated a minimal set of correct answer element objects (CAEOs), followed by generating a copy of the set, and then a set of wrong answer element objects (WAEOs). We employed and tested a fitness function that calculated the mean and standard deviation of object pair distances. The results show that the generation algorithm is capable of generating CAEOs and WAEOs distributions that are unpredictable and encourage exploration. We find that multiplying the fitness function's standard deviation variable by a specific value, which depends on how many objects are to be generated, is crucial to the algorithm's success. We also discuss the limitations of this study and directions for future ones.",IEEE
JOUR,Evaluating Mixed-Initiative Procedural Level Design Tools Using a Triple-Blind Mixed-Method User Study,IEEE Transactions on Games,413,422,"['S. P. Walton', 'A. A. M. Rahat', 'J. Stovold']",2022,"['Tools', 'Games', 'Measurement', 'Optimization', 'Space exploration', 'Evolutionary computation', 'Visualization', 'Content creation', 'evaluation', 'evolutionary algorithms', 'genetic algorithms', 'procedural content']",10.1109/TG.2021.3086215,IEEE Transactions on Games,3,2475-1510,"defaultdict(<class 'list'>, {'VO': ['14']})",14,IEEE Transactions on Games,Sept. 2022,"Results from a triple-blind mixed-method user study into the effectiveness of mixed-initiative tools for the procedural generation of game levels are presented. A tool which generates levels using interactive evolutionary optimization was designed for this study which 1) is focused on supporting the designer to explore the design space and 2) only requires the designer to interact with it by designing levels. The tool identifies level design patterns in an initial hand-designed map and uses that information to drive an interactive optimization algorithm. A rigorous user study was designed which compared the experiences of designers using the mixed-initiative tool to designers who were given a tool which provided completely random level suggestions. The designers using the mixed-initiative tool showed an increased engagement in the level design task, reporting that it was effective in inspiring new ideas and design directions. This provides significant evidence that procedural content generation can be used as a powerful tool to support the human design process. support for the research of this article.",IEEE
CONF,Automatic Generation of Super Mario Levels via Graph Grammars,2020 IEEE Conference on Games (CoG),297,304,"['E. Hauck', 'C. Aranha']",2020,"['Grammar', 'Games', 'Artificial intelligence', 'Tools', 'Task analysis', 'Sprites (computer)', 'Connectors', 'Procedural Content Generation', 'Graph Grammar']",10.1109/CoG47356.2020.9231526,2020 IEEE Conference on Games (CoG),,2325-4289,"defaultdict(<class 'list'>, {'VO': ['']})",,2020 IEEE Conference on Games (CoG),24-27 Aug. 2020,"Automatically generating game levels using Procedural Content Generation (PCG) is a challenging problem because of the necessity of attending both functional and nonfunctional requirements. In the particular example of level generation for Super Mario, Machine Learning approaches, such as GANs and Reinforcement Learning, have shown promise. However, these black-box approaches usually are not explainable, and thus difficult to integrate with human designers. We propose a different level-generation system that uses a reachable graph structure, automatic detection of level structures, and formal graph grammars. A human designer can also easily add or remove structures to use the system as a level co-creation tool. An experimental analysis shows that the proposed system can generate playable and visually pleasing levels, while revealing some limitations of current approaches on platformer level generation, such as the generation of backtracking segments.",IEEE
CONF,Interpreting Multi-objective Evolutionary Algorithms via Sokoban Level Generation,2024 IEEE Conference on Games (CoG),1,2,"['Q. Zhang', 'Y. Li', 'Y. Lin', 'H. Wang', 'J. Liu']",2024,"['Bridges', 'Visualization', 'Procedural generation', 'Spatial diversity', 'Evolutionary computation', 'Real-time systems', 'Optimization', 'Procedural Content Generation', 'Multi-objective Optimisation', 'Multi-objective Evolutionary Algorithms', 'Two_Arch2']",10.1109/CoG60054.2024.10645559,2024 IEEE Conference on Games (CoG),,2325-4289,"defaultdict(<class 'list'>, {'VO': ['']})",,2024 IEEE Conference on Games (CoG),5-8 Aug. 2024,"This paper presents an interactive platform to interpret multi-objective evolutionary algorithms. Sokoban level generation is selected as a showcase for its widespread use in procedural content generation. By balancing the emptiness and spatial diversity of Sokoban levels, we illustrate the improved two-archive algorithm, Two_Arch2, a well-known multi-objective evolutionary algorithm. Our web-based platform integrates Two_Arch2 into an interface that visually and interactively demonstrates the evolutionary process in real-time. Designed to bridge theoretical optimisation strategies with practical game generation applications, the interface is also accessible to both researchers and beginners to multi-objective evolutionary algorithms or procedural content generation on a website. Through dynamic visualisations and interactive gameplay demonstrations, this web-based platform also has potential as an educational tool.",IEEE
CONF,Systematic Review of GAN for Enhancing Efficiency in AI in Gaming,2024 International Conference on Advances in Computing Research on Science Engineering and Technology (ACROSET),1,8,"['J. Singh', 'S. M. N. Islam', 'M. Tewatia', 'D. Garg', 'N. Fatima']",2024,"['Training', 'Visualization', 'Technological innovation', 'Procedural generation', 'Refining', 'Transforms', 'Propulsion', 'Generative adversarial networks', 'Stakeholders', 'Artificial intelligence', 'Generative Adversarial Networks (GANs)', 'Artificial Intelligence (AI)', 'Gaming', 'Video Games', 'Efficiency', 'Enhancement', 'Machine Learning']",10.1109/ACROSET62108.2024.10743943,2024 International Conference on Advances in Computing Research on Science Engineering and Technology (ACROSET),,,"defaultdict(<class 'list'>, {'VO': ['']})",,2024 International Conference on Advances in Computing Research on Science Engineering and Technology (ACROSET),27-28 Sept. 2024,"A thorough analysis of Generative Adversarial Networks (GANs) and how they might be used to improve AI gaming efficiency is presented in this research. Game developers now have never-before-seen possibilities for innovation, immersion, and personalization thanks to GANs, which have become a potent tool for producing realistic data samples across a variety of fields. This review investigates the architecture, training methods, applications, difficulties, and potential future directions of GANs in AI gaming through a thorough analysis of the body of research and publications. The review demonstrates how GANs can transform the game industry by highlighting their many uses in procedural content generation, texture synthesis, character animation, environment design, and content customization. Nevertheless, there are certain difficulties in integrating GANs into AI games, such as computational resources, mode collapse, training instability, and assessment metrics.as well as legal matters. To tackle these obstacles, multidisciplinary research endeavors and cooperation across academic institutions, corporate entities, and regulatory agencies are necessary. Going forward, new avenues for study and developments in GAN technology hold great potential for getting over these roadblocks and opening up fresh possibilities in AI gaming. We can create a future where AI powered gaming experiences change the parameters of interactive entertainment and provide players globally with more engaging, varied, and personalized gaming experiences by utilizing the possibilities of GANs and addressing the related obstacles.",IEEE
CONF,MyRoom: A Unity Plugin for Procedural and Interactive Indoor Scene Synthesis,2023 IEEE Conference on Games (CoG),1,2,"['H. Du', 'Y. Zhao', 'S. Huang', 'J. Bai', 'S. Tian', 'J. Liu']",2023,"['Industries', 'Layout', 'Data visualization', 'Games', 'Generators', 'Room synthesis', 'furniture layout', 'procedural content generation', 'Unity plugin', 'VR games']",10.1109/CoG57401.2023.10333189,2023 IEEE Conference on Games (CoG),,2325-4289,"defaultdict(<class 'list'>, {'VO': ['']})",,2023 IEEE Conference on Games (CoG),21-24 Aug. 2023,"The demand for indoor synthesis has increased significantly in recent years because of the emergence of computational design. This work designs and develops MyRoom, a Unity plugin that can import layout datasets for indoor synthesis and procedurally generate and interactively design indoor scenes. MyRoom enables users to easily edit and visualize non-intuitive layout description data, making it easier to generate and manipulate indoor scenes in Unity. MyRoom provides a user-friendly interface and powerful tools for designing and optimizing indoor layouts, including an automatic layout generator, making it ideal for game developers, interior designers, and researchers in the digital world-building industry. With MyRoom, users can streamline the process of creating high-quality indoor scenes in games and achieve their design goals efficiently.",IEEE
CONF,Leveraging Large Language Models for Enhanced VR Development: Insights and Challenges,"2024 IEEE Gaming, Entertainment, and Media Conference (GEM)",1,6,"['A. Alkhayat', 'B. Ciranni', 'R. S. Tumuluri', 'R. S. Tulasi']",2024,"['Large language models', 'Training data', 'Games', 'Virtual reality', 'Chatbots', 'Encoding', 'Software', 'Unity Game Engine', 'Virtual Reality', 'ChatGPT', 'AI-Assisted Programming', 'LLMs']",10.1109/GEM61861.2024.10585495,"2024 IEEE Gaming, Entertainment, and Media Conference (GEM)",,2766-6530,"defaultdict(<class 'list'>, {'VO': ['']})",,"2024 IEEE Gaming, Entertainment, and Media Conference (GEM)",5-7 June 2024,"This paper delves into the capabilities of Large Language Models (LLMs) in supporting beginner programmers in crafting virtual reality (VR) content for gaming and simulation applications. Our research group, comprising both seasoned and novice VR developers, engaged with versions of ChatGPT, including 3.5, 4, and Bard with Gemini Pro, during the development of various VR projects, spanning games to simulations. The findings, reflected through a comprehensive analysis of code quality and usability metrics, reveal that LLMs offer significant advantages for newcomers in the field. However, we also identify several challenges that must be addressed. This study enriches the discourse on obstacles faced in VR development and elucidates the impact of LLMs on coding and software creation, shedding light on both the advantages and hurdles of integrating LLMs into VR game production.",IEEE
CONF,Learning Controllable Content Generators,2021 IEEE Conference on Games (CoG),1,9,"['S. Earle', 'M. Edwards', 'A. Khalifa', 'P. Bontrager', 'J. Togelius']",2021,"['Training', 'Conferences', 'Games', 'Reinforcement learning', 'Aerospace electronics', 'Tools', 'Generators', 'procedural content generation', 'reinforcement learning', 'game AI', 'pcgrl', 'conditional generation']",10.1109/CoG52621.2021.9619159,2021 IEEE Conference on Games (CoG),,2325-4289,"defaultdict(<class 'list'>, {'VO': ['']})",,2021 IEEE Conference on Games (CoG),17-20 Aug. 2021,"It has recently been shown that reinforcement learning can be used to train generators capable of producing high-quality game levels, with quality defined in terms of some user-specified heuristic. To ensure that these generators' output is sufficiently diverse (that is, not amounting to the reproduction of a single optimal level configuration), the generation process is constrained such that the initial seed results in some variance in the generator's output. However, this results in a loss of control over the generated content for the human user. We propose to train generators capable of producing controllably diverse output, by making them “goal-aware.” To this end, we add conditional inputs representing how close a generator is to some heuristic, and also modify the reward mechanism to incorporate that value. Testing on multiple domains, we show that the resulting level generators are capable of exploring the space of possible levels in a targeted, controllable manner, producing levels of comparable quality as their goal-unaware counterparts, that are diverse along designer-specified dimensions.",IEEE
CONF,A quantum procedure for map generation,2020 IEEE Conference on Games (CoG),73,80,['J. R. Wootton'],2020,"['Qubit', 'Quantum computing', 'Games', 'Computers', 'Hardware', 'Extraterrestrial measurements', 'Correlation', 'Quantum computing', 'Procedural content generation', 'game development', 'graph algorithm']",10.1109/CoG47356.2020.9231571,2020 IEEE Conference on Games (CoG),,2325-4289,"defaultdict(<class 'list'>, {'VO': ['']})",,2020 IEEE Conference on Games (CoG),24-27 Aug. 2020,"Quantum computation is an emerging technology that promises a wide range of possible use cases. This promise is primarily based on algorithms that are unlikely to be viable over the coming decade. For near-term applications, quantum software needs to be carefully tailored to the hardware available. In this paper, we begin to explore whether near-term quantum computers could provide tools that are useful in the creation and implementation of computer games. The procedural generation of geopolitical maps and their associated history is considered as a motivating example. This is performed by encoding a rudimentary decision making process for the nations within a quantum procedure that is well-suited to near-term devices. Given the novelty of quantum computing within the field of procedural generation, we also provide an introduction to the basic concepts involved.",IEEE
JOUR,Danesh: Interactive Tools for Understanding Procedural Content Generators,IEEE Transactions on Games,329,338,"['M. Cook', 'J. Gow', 'G. Smith', 'S. Colton']",2022,"['Generators', 'Games', 'Tools', 'Measurement', 'Annotations', 'Visualization', 'Buildings', 'Computational creativity', 'generative software analysis', 'procedural generation']",10.1109/TG.2021.3078323,IEEE Transactions on Games,3,2475-1510,"defaultdict(<class 'list'>, {'VO': ['14']})",14,IEEE Transactions on Games,Sept. 2022,"In order to advance the field of procedural content generation, and transfer knowledge from academic research to everyday use, we need to develop tools that make generative systems easier to understand and control. In this article, we introduce Danesh, a plugin to the unity game development environment, which helps provide a suite of tools that provide automation or analysis of different aspects of procedural generators. We describe here the features of Danesh, including automatic analysis of generated content, the visualization of generative spaces, automatic parameter discovery, and interface smoothing. We also provide reflections on our development of the tool so far.",IEEE
CONF,Generating Procedural Dungeons Using Machine Learning Methods,2020 19th Brazilian Symposium on Computer Games and Digital Entertainment (SBGames),90,96,"['M. Werneck', 'E. W. G. Clua']",2020,"['Games', 'Machine learning', 'Rocks', 'Shape', 'Production', 'Automata', 'Navigation', 'procedural generation', 'Machine Learning', 'Dungeons', 'UnityML']",10.1109/SBGames51465.2020.00022,2020 19th Brazilian Symposium on Computer Games and Digital Entertainment (SBGames),,2159-6662,"defaultdict(<class 'list'>, {'VO': ['']})",,2020 19th Brazilian Symposium on Computer Games and Digital Entertainment (SBGames),7-10 Nov. 2020,"Procedural content generation (PCG) is a powerful tool to optimize creation of content in the game industry. However, it can lead to lack of control and mischaracterization of the game design, creating unbalanced or undesired situations. To overcome such problems, machine learning can be used to map important patterns of a game design and apply them in the PCG. Considering such aspects, this paper proposes a strategy for procedurally generating dungeons using ML techniques. We use Unity ML-Agents tool for the implementation, since dungeons are environments largely used in the industry that also require more control over its creation. The strategy used in this paper has proven to generate dungeons that respect room positioning design choices and maintains the game characterization. We conclude, after conducting a survey with users, that the generated dungeons presented reliable maps and showed to be more enjoyable and replayable than manually generated ones following the same design principles.",IEEE
CONF,Learning to Evolve Procedural Content in Games Using Cultural Algorithms,2022 Fourth International Conference on Transdisciplinary AI (TransAI),106,115,"['S. Saad', 'T. Palazzolo', 'C. Zhang', 'R. G. Reynolds', 'A. Lemke', 'J. O. Shea', 'C. O’Shea']",2022,"['Education', 'Virtual reality', 'Games', 'Machine learning', 'Evolutionary computation', 'Prediction algorithms', 'Cultural differences', 'Procedural Content Generation', 'Evolutionary Algorithms', 'Cultural Algorithms', 'Virtual Reality', 'Stem education']",10.1109/TransAI54797.2022.00026,2022 Fourth International Conference on Transdisciplinary AI (TransAI),,,"defaultdict(<class 'list'>, {'VO': ['']})",,2022 Fourth International Conference on Transdisciplinary AI (TransAI),19-21 Sept. 2022,"The procedural content of a virtual reality system is a key contributor to its success. However, it is often the case that the content needs to be adjusted. This may take place for a variety of reasons. This research investigates the possibility of the use of machine learning technology to facilitate the modification of a games content. Here, the Deep Dive system was designed originally to predict ancient site locations. Recently it was repurposed to be used as an educational tool to facilitate aspects of STEM education. This required the modification of the content to support this novel use. An evolutionary learning algorithm, Cultural Algorithm, is employed to facilitate the addition of the new content required for the educational application.",IEEE
CONF,Generating Race Tracks With Repulsive Curves,2024 IEEE Conference on Games (CoG),1,8,"['L. Henrich', 'F. Kötter']",2024,"['Training', 'Solid modeling', 'Video games', 'Three-dimensional displays', 'Shape', 'Special issues and sections', 'Quality control', 'procedural content generation', 'racing games', 'race track generation', 'racing AI', 'difficulty evaluation']",10.1109/CoG60054.2024.10645670,2024 IEEE Conference on Games (CoG),,2325-4289,"defaultdict(<class 'list'>, {'VO': ['']})",,2024 IEEE Conference on Games (CoG),5-8 Aug. 2024,"Procedural content generation is a useful tool for content creation in computer games. We present a novel approach for generating closed, arcade-like race tracks. Our system generates an initial shape by growing a curve inside a constrained space under self-repulsion, hence avoiding self-intersections while ensuring tight packing. This system is capable of generating a wide variety of closed race track shapes with deep customization options, like an isometric alignment of straight sections as developed here. Further, we devise algorithms for fitting the shape to a spline and introducing intersections, as well as fully generating a 3D model with features like crossings and bridges. We integrate the generated tracks into a game by training AI opponents and using them for automatic difficulty evaluation.",IEEE
CONF,Analysis of Maze Generation Algorithms,2024 5th International Conference on Innovative Trends in Information Technology (ICITIIT),1,6,"['J. Vijaya', 'A. Gopu', 'K. V. S. G. Vinayak', 'T. J. Singh', 'K. Malhotra']",2024,"['Measurement', 'Procedural generation', 'Scalability', 'Layout', 'Prediction algorithms', 'Market research', 'Complexity theory', 'Depth First Hunt', 'Prim’s Algorithm', 'Recursive description', 'Procedural content generation']",10.1109/ICITIIT61487.2024.10580178,2024 5th International Conference on Innovative Trends in Information Technology (ICITIIT),,,"defaultdict(<class 'list'>, {'VO': ['']})",,2024 5th International Conference on Innovative Trends in Information Technology (ICITIIT),15-16 March 2024,"Procedural content generation plays a crucial role in modern game development, offering efficient methods for creating intricate mazes, a prime example of its utility. However, when it comes to homemade maze generation, there’s often a limitation in providing the necessary diversity of mazes to maintain player engagement. Predictability can creep in, diminishing the player’s experience. In this composition, we embark on a comprehensive exploration of three introductory 2-D maze-generation algorithms, firstly, DFS (Depth-First Search), secondly, Recursive description, and lastly Prim’s-Method algorithm. Rather than merely analyzing these algorithms, our focus is on addressing their inherent drawbacks. Specifically, we aim to find solutions to enhance their utility in game development, particularly in terms of improving path lengths and increasing the diversity of generated mazes. In essence, procedural content generation, as exemplified by maze generation algorithms, serves as an indispensable tool for game designers seeking not only to understand the limitations but also to find creative solutions that strike a balance between generating engaging content and maintaining gameplay diversity.",IEEE
CONF,Compressing and Comparing the Generative Spaces of Procedural Content Generators,2022 IEEE Conference on Games (CoG),143,150,"['O. Withington', 'L. Tokarchuk']",2022,"['Dimensionality reduction', 'Data compression', 'Games', 'Generators', 'Behavioral sciences', 'Reliability']",10.1109/CoG51982.2022.9893615,2022 IEEE Conference on Games (CoG),,2325-4289,"defaultdict(<class 'list'>, {'VO': ['']})",,2022 IEEE Conference on Games (CoG),21-24 Aug. 2022,"The past decade has seen a rapid increase in the level of research interest in procedural content generation (PCG) for digital games, and there are now numerous research avenues focused on new approaches for driving and applying PCG systems. An area in which progress has been comparatively slow is the development of generalisable approaches for comparing alternative PCG systems, especially in terms of their generative spaces. It is to this area that this paper aims to make a contribution, by exploring the utility of data compression algorithms in compressing the generative spaces of PCG systems. We hope that this approach could be the basis for developing useful qualitative tools for comparing PCG systems to help designers better understand and optimize their generators. In this work we assess the efficacy of a selection of algorithms across sets of levels for 2D tile-based games by investigating how much their respective generative space compressions correlate with level behavioral characteristics. We conclude that the approach looks to be a promising one despite some inconsistency in efficacy in alternative domains, and that of the algorithms tested Multiple Correspondence Analysis appears to perform the most effectively.",IEEE
